{
  "id": "phase11-fukui-normalization",
  "phase": 11,
  "status": "reviewed_maximum_depth",
  "prefecture_code": "18",
  "source_catalog": "data/reviewed/phase9/18.json",
  "normalizer": "scripts/normalize_phase11_fukui.py",
  "shared_normalizer": "scripts/phase11_phase9_raw.py",
  "record_schema": "schemas/phase11_record_linkage.schema.json",
  "expected_normalization": {
    "record_count": 114,
    "linked_record_count": 0,
    "partial_record_count": 114,
    "not_linked_record_count": 0,
    "indicator_series_count": 114,
    "annual_actual_available_count": 0,
    "future_target_available_count": 0,
    "reviewed_maximum_depth_record_count": 114,
    "policy_achievement_assessment_count": 0
  },
  "document_boundary": {
    "registered_document_count": 6,
    "document_reviewed_row_counts": [1, 102, 0, 7, 3, 1],
    "document_reviewed_row_total": 114,
    "canonical_record_count": 114,
    "documents_with_zero_reviewed_rows": 1
  },
  "maximum_depth_rule": "All 114 canonical Phase 9 Reviewed statements remain raw maximum-depth records until vision, execution-plan, regional-plan, demographic-strategy, values, periods, units, and publication roles can be mapped through reviewed table-level evidence.",
  "hierarchy_boundary": "The long-term vision toward 2040, the 2025-2029 execution plan, east and west regional plans, and the population-decline strategy remain separate planning layers. Three broad source-index regions and six regional-plan operating areas are not merged.",
  "evaluation_boundary": "Annual challenge goals and their results remain execution-review records and do not become an overall achievement judgment for the long-term vision.",
  "non_goals": [
    "Do not fill the zero-row full-version document with inferred records.",
    "Do not merge the long-term vision and execution plan into one target layer.",
    "Do not merge three broad regions with six operating regions.",
    "Do not treat annual challenge results as overall vision achievement.",
    "Do not infer actuals or targets from contents pages or mixed raw text.",
    "Do not replace missing units or split multiple values by inference.",
    "Do not calculate causality or cross-prefecture ranking."
  ],
  "updated_at": "2026-08-02"
}
